Avoid it like the Plague!,"We stayed for four nights in June.  I'll start with the positives. It is a modern hotel with spacious rooms. However we encountered a number of problems whilst we were there. Firstly, we had booked a Double room and had a condirmation in our hand yet  reception would only give us gave us a Twin Bedroom. As this hotel caters for large overseas bus groups there were long time consuming lines at reception. The hotel   is a long way from the city centre, only one restaurant nearby,  so your only option is to take the metro to get anywhere. Fortunately, the metro is 5 minutes away.Perhaps the biggest problem of all was the building works going on next door. The noise would start early in the morning and continue into the late afternoon. A lot of  Loud pounding  and  banging. There was a huge crane on the building site so it appears the building works will continue for some time yet. We were disappointed with this hotel as it was our first time in Amsterdam.",6.0,4.0,4.0,,,4.0,255100Max,"Melbourne, Australia",TripAdvisor,2011-08-06good as it be,"Staff is rude and not very helpful. Arrogant for doing nothing. Lasting impression were extremely poor- rubbish checking out system; never seen such organision! Absolutely no remorse from staff, probably due to them being so confused by their checking out system! Might have been a different story if we were in our other very normal car, as undoubtedly this would have had substantial damage! Good first impression. Turned up early to be allowed to check in- room clean n bed comfy- adequate bathroom. Not 1.9km from city- don't know how far but took us 1 hour to walk there and 1 hour to walk back, and noone tell us that there is a train nearby!",6.0,4.0,2.0,4.0,2.0,2.0,vanhiephoang,Hanoi/vietnam,TripAdvisor,2011-11-02Great hotel ... too far,"The hotel itself is pretty good. Very modern, standard rooms on space but also furnished with modern gear. With respect to cleanliness, like everything in life, there are worse and better so I give it a 7. the receptionists if they deserve 10 all very friendly and attentive.As I say, my only but, is the distance from the center. 30-40 would walk min. By bus arrive in 10-20. Removing this is a highly recommendable hotel for a few days in the city. Worth it. ",6.0,8.0,6.0,8.0,6.0,10.0,ClauFP19,"Salamanca, Spain",TripAdvisor,2013-08-07Good value business hotel,"We stayed 2 nights in the hotel on a business trip to Amsterdam.First its location in Amstel seemed to be quite far from the center.We found however that the metro station is only at 5 minutes walk what is not bad at all. Besides the hotel rents bikes what is also a great way to get to the centre.Otherwise the area does not offer many attractions.It also looks that there are contructions nearby and the hotel can be noisier in the mornings.Fortunately we did not experience it during our stay.The room is rather large compared to the average Amsterdam hotel rooms although still modest in size.It was clean and looked like freshly renovated.Free wifi is available in the whole building.The staff was friendly and helpful.It is also important that the hotel has a garage what is almost impossible to get at a hotel closer to the centre.",6.0,8.0,8.0,6.0,6.0,8.0,Gabor274887,"Budapest, Hungary",TripAdvisor,2012-04-07clean but very basic,"this a very basic overpriced hotel in the middle of nowhere. No character. You wouldn't know that you were in Amsterdam, Holland or even Europe.",6.0,4.0,2.0,4.0,4.0,2.0,michealCork_Ireland,"Cork, Ireland",TripAdvisor,2011-09-27good for short trip,"We were only in Amsterdam for one night, so we weren't overly concerned with what the hotel would be like. Hotel Casa 400 was a perfectly fine hotel for a one night stay, and would probably also be good for business travel. The staff was friendly, helpful and spoke excellent English, but quite rude if you can not find your booking. The train, metro and bus station is five minute walk from the hotel, and the trip to Central Station takes less than 10 minutes. There is on-site, gated parking for 17,50 Euros per day, BF 15 EURO.Our room was minimalist, but brightly colored chairs and brown-padded walls added a nice accent. Stay here if you enjoy being woken up by noisy students returning late to this building, which doubles up as halls of residence, for the nearby university.  The air conditioning seems to work in parts of the hotel, in the parts that it does not work. The lifts in a morning are horrendous, We were on the third floor and waited 10 minutes before deciding to go up to go down and the beakfast, despite being give a ""Special Offer Discount"" upon arrival were basic and definitely did not cater for vegetarians with anything cooked. While the rooms were ok, the value stops there! In the summer it was hot, no fans available and only a small window vent. The vent could not be opened because some guest were allowed to party, loudly in front of the hotel until 2-3 am each morning. Would find guests or some people sitting or laying in the floors near elevators or guestrooms. There was also a large tabletop running along the window that would be great for business. The free Wi-Fi had a strong signal and worked great. The bed was incredibly firm- a little too firm for my taste, but my husband loved it. The aforementioned chairs, however, were horribly uncomfortable- fine enough for sitting it to put on your shoes, but not for long periods of time. If you're the type of traveler who just uses your room to sleep in, this is a great choice, but if you plan to spend lots of time in your room, you may want to consider somewhere else.",6.0,4.0,4.0,,,2.0,GerhardSchutz,"Ho Chi Minh City, Vietnam",TripAdvisor,2011-08-19"Minimalist, no character, and poor service","I was in Amsterdam for business, and spent a week at the CASA.  Way too long to be there.Its new, clean, and bright, but its more like student accommodation.The rooms are small and boring, but there is free wifi throughout - rather frustrating that you have to re-authorize your device each time you go from one hotspot to another (e.g. room to bar or lobby), so with a smart phone you think you are connected but not really.Breakfast is like a mad house free for all and was often out of fresh hot food items, whole fruits, and juices.Food and service in the bar restaurant were both mediocre and hit and miss.  The bar/restaurant manager was good.Its a pity but it seems that Amsterdam hotels survive on short stay tourists and conventions at the Rai - neither of which demand a good level of service.I will not stay at the CASA in future.",6.0,4.0,6.0,4.0,4.0,4.0,David H,"Denver, Colorado",TripAdvisor,2012-09-14"Our car and another five cars got broken into, won't be coming back","Unfortunately our car and another 5 five cars got broken into. We paid for privilege of having our car secured in the hotel underground car parking yet it got broken into. They have security cameras all over the place, I wonder how this happened?, We were given our room back for the rest of the day but they wanted us to leave ASAP, never mind you and your family traveling all the way back to your home country with a provisional window glass. Won't be coming back. Very bad experience.",2.0,2.0,2.0,,,2.0,M M,"Amsterdam, The Netherlands",TripAdvisor,2011-09-03"catastrophic worth avoiding, thieves!","I booked in May to spend three days in August (with a lot of advances!): From August 12 to 15 with two girlfriends.I called the morning of the 12th to confirm my booking and that we arrive late in the evening.We arrived after a long voyge Friday 12 evening (very tired) and the reception informed us that nya more rooms available!The reception does not apologize but told us that even when the first night will be free and we are accommodated in another hotel ...When paying, so we each pay only 2 nights 3.After I checked my bank statement and I noticed that the first night was also collected for me and my two girlfriends on my acct and another levy the following 2 nights!! (my card used for the booking)We were then lied about their politics, have left us paid for two nights and then gently taken the first night.THEY ARE THIEVES IS EXTREMELY BADOther details:The service is the bare minimum, the towels are not changed evenThis hotel is far from downtown, planning transport and train station if you want nightlife budget, then it's hell to get ",2.0,2.0,2.0,,,2.0,sarra m,"Strasbourg, France",TripAdvisor,2011-08-18There is a thief amongst the staff,"I had a parcel delivered to the hotel. After being told about the rigorous process that is followed when a package is delivered (i.e filing etc), I was told by the manager on duty that a member of her staff had signed for the parcel. Only to be told that they have no idea where is was. The next day a different manager refused to acknowledge that the parcel had been received. Staff should be searched, and managers hired should have more integrity. Absolutely disgusted with the manner in which this was handled. Clearly they assume ownership of goods once delivered. Don't make this mistake. Spend a little more money, knowing your belongings won't be stollen by the staff at reception!!",6.0,2.0,2.0,6.0,6.0,2.0,Tesantha N,"Johannesburg, South Africa",TripAdvisor,2012-08-22"good location, poor quality room","Asked for working safe and working fridge, but never got fridge fixed or replaced. Air conditioning not working, windows had locks on them, small crowded bathroom, tub did not drain very well, towels not very nice to use. Poor exchange rates for money at counter.",4.0,4.0,,,,4.0,Stephen,,Hotels.com,2012-06-01