new hotels,"The two favorable characteristics hotel are:1. new structure2. priceIn two we spent 70 euro per night including taxes but excluding breakfast. Booking a short time before we could not find any hotels with a lower price.The new structure is as I said. You have to admit that it was very well designed to make a good impression by limiting spending as much as possible.They are small things, however, affect the final cost of the structure and not seen at first glance. For example there is no hair dryer in all rooms, but you have to ask for it.The reception delivers it for free but they have a tot: if dovessere be all out is likely to remain with wet hair.The hotel is clean and it deserves a 7.Nothing more. Who gave scores above probably has never seen facilities and services.Condinuando with the description:good cleaning, wi-fi, safe (in-room safe and unrestricted access to the lifts only with the magnetic key of the room), carpet in the bedrooms, bathrooms poorly lit. Staff unfriendly and unprofessional. We sent an email a week before our arrival and we never received a response. They have not surrendered a map, did not indicate the means closer, they did not say a word nor upon our arrival to our departure.Never mind, we were informed, but they sure were not professional.The rooms have all the mattresses, though neighbors. If you want a single mattress or rather a single duvet must pay 10 Û more (you get but also a kettle and tea bags).You can safely save Û 10. The beds are still attached.The hotel is far from downtown, close to the metro station Amstel.To remember that the quickest way to get to the station is behind the hotel through the steps. If you do not do the steps lengthened the distance of approximately 300 meters. ",6.0,6.0,6.0,,,6.0,Makeda_01,"Venice, Italy",TripAdvisor,2011-09-12"Convenient, modern, place","This hotel is very recent, but remains cold in its modernity. For instance LED and fluorescent lighting in the rooms may be efficient, but it isn't very welcoming. Also the beds could be better: they don't have a traditional matras, but rather a kind of 'fouton' on a matras. Because of the gap between the beds this was very inconvenient.Very large hotel with only a handful elevators means long wait times in the morning when you want to get downstairs.Rather noisy too: woken up in the middle of the night by some (drunk?) neighbours (but I guess that may happen in no matter which hotel in Amsterdam :-)  ), but also by ambulance sirens. Location is ok, because of a good metro connection within a 5 minutes walk.Next time I'll look for another place, because the price wasn't cheap either.",6.0,6.0,4.0,6.0,6.0,8.0,Fly_Peter,Antwerp,TripAdvisor,2012-10-01Big hotel again a little charmless away,"We stayed for 3 nights on the 6th floor of the left wing, is a great hotel if you compare the small buildings that are in Amsterdam, is a mini factory rooms, in the hall there are always people. This hotel has no charm, since it has nothing besides itself can habitacin.Con your key card access entry to the hall and to the use of the elevator. Pure business. It will take about 4 years back, the room is fine, big bed, clean, with tea, coffee and tea, fridge (is empty). The only problem is that is in the midst of more or less anything, bone appears as an office area, and just go there to go to sleep and that's it because there is nothing to do. Amstel Station is 4 minutes, which allows you to go downtown in 5 stops. (10 minutes) Central Station. The connection is reduced to tram line 12 that leads to the museum area of Van Gogh and National. So it is advisable to have a bonus day (we took 3 days) metro, bus and tram are 16 euros for 3 days.",6.0,6.0,6.0,6.0,4.0,6.0,MSzgz,"Zaragoza, Spain",TripAdvisor,2012-08-15"Good hotel, but not for both. -","Good hotel, especially with regard to common areas (reception, restaurant, etc..). I recommend getting breakfast in the room, the buffet served pretty well. The rooms are somewhat disappointing, but comfortable. IKEA roll that does not justify some deficits. The ""stippled"" Wall and ceiling left me cold blood ...",6.0,6.0,6.0,4.0,8.0,8.0,EnClaveTrotamundos,"Brussels, Belgium",TripAdvisor,2012-08-11Basic hotel and expensive,"Very disappointed with this hotel. Expensive for what you got and for a non central location. A basic, unwelcoming room. I was charged 10 euro for an adaptor, there was no option to borrow, even with a returnable deposit. Breakfast was nice",6.0,4.0,4.0,2.0,2.0,6.0,LadyIreland,Ireland,TripAdvisor,2012-05-11Not quite comfortable accommodation in the center,"Hotel is easy to reach from Amstel Station. Walking distance to shopping, downtown, canals and sights can be reached. Hotel room with a fridge, kettle (tea and instant coffee is nachgefhlt), television and safe. Rooms are clean (carpets looked a little dingy). Unobtrusive and very friendly staff on contact. Breakfast and bar us was too expensive, but Amsterdam offers other possibilities. Check-in and check-out were a problem. On departure you can leave your luggage there and pick up in the evening (very courteous)! The hotel serves as Konferenz-/Tagungshotel, did not bother us.",6.0,10.0,,,,8.0,Stefan,,Hotels.com,2013-03-01acceptable,"Newly built hotel, modern, not in the center, but the metro station, tram and bus comoda.Camera spacious (we were 3) bathroom without window with doccia.Pulizie accettabili.Frigo for use personale.Parcheggio 20 Euro per day.We've without breakfast, which we considered too expensive (though possibly in the lobby, there is a corner where they sell coffee, cappuccino & co.)",6.0,6.0,6.0,6.0,6.0,6.0,mammarotty,,TripAdvisor,2013-07-11A city to get around on two wheels.,"Hotel that has been proven to reception, pleasant staff who provided all the information for a good stay. The rooms are spacious, well furnished and equipped with kettle water heater to use for themselves to tea and coffee. On each floor there is an ironing room available for guests. The hotel also provides bicycles that can be rented at the reception and are the best way to see this city. The bike paths are too tempting and allow you to run both in the center and in the periphery (muiden is a small village 7 km from Amsterdam - worth a visit). We also appreciated the opportunity to make a quick breakfast at the corner next to the reception, of course, for those who love us as a coffee and croissant! Why 15 euro for that traditional table is a cost we think a little excessive. Nice also the bar upstairs, pleasant and very helpful staff. Overall a very pleasant stay",6.0,8.0,8.0,8.0,6.0,8.0,blandyBustoArsizio,BUSTO ARSIZIO,TripAdvisor,2012-08-21a modern 3* hotel,"IÕve visited Amsterdam about 20 times. Given the TripAdvisor reviews I had high expectations but was disappointed. The room and bathroom were basic, very little space on the floor in the bedroom for a suitcase; the bathroom had lighting and a mirror but neither was well positioned for shaving. The shower lacked water pressure to the extent that only 30% of my body could get under the water at one time Ð IÕm an average size. Around the plastic hand basin were two cigarette butt burn marks (room 625); I appreciate they are not the fault of the hotel but they need to be sanded and polished out; there were no tissues. Trams run near the hotel for much of the night; whilst the hotel appears new and has double glazing the soundproofing (perhaps in the walls) is insufficient such that you can hear the rumble as trams pass by. A new multi storey building is being built next door and the hotel has thoughtfully put foam ear plugs in the bedrooms to minimise that disturbance Ð IÕd asked for a quiet room but needed the earplugs to shut out the noise of the trams Ð when one earplug came out during the night I woke up and had to put it back in before I could sleep again.I booked via hotels.com and paid UK£110.96 however on arrival I was advised by the hotel that a local Amsterdam tourist tax was not included Ð after they had checked internally I was forced to pay this additional tax. I took exception to this additional charge of 4.60 euros as my receipt listed ÒTaxes and FeesÓ and quoted a ÒTotal PriceÓ. In my view it is not acceptable to quote a total price, bank the money and then for the customer to be hit with an additional unexpected charge that was not previously mentioned. The front desk personnel were polite and helpful but lacked the authority to correct this basic problem. The staff in the restaurant plentiful but spent their time talking amongst themselves instead of providing a good service. The food in the restaurant was OK but not cheap Ð a one course club sandwich lunch with soft drinks and coffee came to 18 euros each. The free Wi-Fi worked well and the bed was comfortable but at UK£115 for one night, room only, in early February in a suburb of Amsterdam did not to me represent good value for money; 85 euros / £70 would in my view have been more appropriate",4.0,4.0,2.0,4.0,4.0,4.0,SeriousTraveller01,London,TripAdvisor,2012-02-07good for some nights,"I stayed on this Hotel for 3 nights. The hotel looks modern superficially. But the service and breakfast in particular are in big question mark. My bed sheets were not changed, the room was not cleaned very well. As this hotel caters for large overseas bus groups there were long time consuming lines at reception. The hotel is a long way from the city centre, only one restaurant nearby, so your only option is to take the metro to get anywhere. Fortunately, the metro is 5 minutes away.Casa 400 has a business model: rooms appear as cheap when you want to book, but you have to take into account that breakfast is not included (Û15). Want to have your breakfast in the vicinity? Good luck.",6.0,4.0,6.0,,,2.0,alvincenthanoi,"Hanoi, Vietnam",TripAdvisor,2011-08-11Better intention from the employees than result from the Hotel,"I stayed one week for business.I asked for a quiet room.With good weather it was perfect but when it was raining heavily it was a nightmare.The drops made a real noise when hitting the metal structure of the Hotel.Unfortunately it rained heavily all the week!!!Not to blame the receptionist of course.The bath cleaning was not good. In one week you can easily understand it.The breakfast was full of choice but the quality of the food was poor.At dinner I eat there just once. Nothing to complain or to mention.The Hotel, even if is not in the centre, is well connected with the subway, just a few minutes away.",4.0,4.0,4.0,8.0,8.0,8.0,SailorTicino,Ticino,TripAdvisor,2012-08-20This is certainly better,"I'll start with the positive to: The subway station on the route to the city center is within walking distance in about 5 minutes, there are only a few stops to the city center and measured against some German city the price is moderate - that was it actually already. The location of the hotel is not very inviting, except during my stay there was a construction site next door. The room was spartan (probably should be modern, but it was not), the Empang and breakfast standard, not reasonable (carpet pretty dirty) was purified and Non smoking rooms found after cleaning cigarette ashes on a shelf by the window.",4.0,6.0,6.0,,6.0,6.0,gerbil9760,"Frankfurt, Germany",TripAdvisor,2011-10-24"Modern, but not off to a good start","We requested a non-smoking room, which is not too much to ask in a non-smoking hotel.  However, as soon as we stepped into our room, the smell of stale smoke was apparent.  We phoned reception, and agreed to have someone spray the room.  However that did not completely eliminate the problem, as the stale smoke was actually in the towels.  Did this mean the person who previously stayed in this room smoked in the bathroom and contaminated the towels?  Therefore, were the towels changed before we arrived???We were unfortunate to also experience another issue.  Whilst relaxing in our room, the door was unlocked and another client entered our room.  They had mistaken our room for theirs. But how did their security key work on our door?  We immediately contacted reception, who attended to this security issue immediately, cancelled our door key and gave us another.2 big mistakes in one day, is a bit off putting to us.  We have been travelling around and not experienced anything quite like it before!",4.0,6.0,6.0,8.0,6.0,6.0,Lynette B,"Auckland Region, New Zealand",TripAdvisor,2012-09-14"A little 'off the beaten track, but comfortable","I stayed in this hotel for 3 days in early July. It was a business trip and I shared the room (a room with two single beds) with a colleague. The hotel is ultra modern, spacious and youthful looking. The room was comfortable, very spacious with a large window and a desk very convenient for business travelers. In addition, the room is equipped with mini bar and safe. Daily cleaning is average, not great. I did not partake of breakfast, to be paid separately at a cost of around 12 Û per person, but in the lobby in the morning was opened a small eatery where to buy donuts, coffee, cappuccino and more cost-effective. It 'sa bit far from downtown, but about 5 minutes walk there is a tramway station and the subway. Overall it was a great stay. A tip: bring the hair dryer from home! Was missing in the room and we had to buy it!",6.0,8.0,8.0,8.0,6.0,6.0,Martha K,"Florence, Italy",TripAdvisor,2012-08-27Ideal starting point for Amsterdam,"The hotel is excellent with the A2 respectively. To achieve S110 and saves a tedious task according to the booked accommodation in a strange city. The hotel has a well-secured underground parking (20 Û / 24 hours) and the metro station is 300 meters range. After a 15-minute drive leads to the PVN the heart of the city. The purchase of a 24-hour tickets (7.50 Û) has paid off for us. The hotel is stylish modern, the staff very helpful at the front desk and rooms - for this Sternekategoie - quite spacious. We had a room on the 10th Floor and it was very quiet. The bathroom also offers plenty of space. Only one point deduction in the assessment is concluded by the dirty bathroom: pubic and body hair on the floor and in the sink as well as tracks in the toilet. Here was cleaned carelessly. The breakfast, however, offers everything your heart desires. Croissonts tasted the best.",2.0,8.0,10.0,10.0,10.0,10.0,Franziskus K,"Cologne, Germany",TripAdvisor,2012-07-28Away from the center but well connected,Good Hotel for a short stay in Amsterdam. Away from the center but well connected to the Amstel station 300 meters away and offers rental bicycles. Staff very helpful and pleasant. Cleaning the bathroom well but not so much room. The area has no appeal whatsoever with which you have to scroll forever.,6.0,8.0,6.0,8.0,4.0,8.0,Gadium,"Cadiz, Spain",TripAdvisor,2012-09-02An efficient hotel a short walk from Amstel Station,"Hotel Casa 400 is a very large property, with about 950 rooms, but the hotel is not at all chaotic and it is managed well.The staff at reception were very efficient and helpful with tourists.The property is modern and so are the rooms and furniture. We took a room and it was very spacious and comfortable, with fridge and safe. We appreciated very much the wifi in the room but Amsterdam is a constant have free wifi everywhere you go.The hotel is a short walk from Amstel Station, a station where you can take a tram (about 15 min. Was in the center), metro, buses and intercity trains.We loved it, the only flaw in the cleaning of the room: in 5 days were past the vacuum cleaner once. For the rest of Hotel Casa 400 is recommended. ",6.0,8.0,6.0,8.0,8.0,8.0,Felice_78,"Naples, Italy",TripAdvisor,2012-08-31"Good hotel, location ok","This hotel is very nice.The rooms are modern, decent sizes and good bathrooms. I had a double with a queen bed, all was clean.I did not like that they never changed our drinking glasses, we stayed 4 nights.The location is ok, very outside the center, but it's a 5 minutes walk to the Amstel metro station, also connects to Tram 12 that takes you to museum plaza!I would suggest it :)No idea about the breakfast, I did not include it in the price!",6.0,8.0,8.0,8.0,6.0,6.0,Debbie1990nau,"Milan, Italy",TripAdvisor,2013-06-29GOOD FOR ALL!,"the hotel is a brand new, young and friendly staff (speaks English and a little Italian, but if you chew a little we understand very well), very good restaurant (we ate more meat and was very tasty), rooms and bathrooms very beautiful. Only one day did not change the towels. in front are building, they begin to work at 7:30 in the morning, but it was not a problem since you go to Amsterdam to visit and not to sleep (in each case ask them if they give you earplugs)! Breakfast excellent and plentiful. to get to downtown just go to the nearby Amstel station and you will find metro (51,52,53) and buses. I recommend you do OV card for tourists (24, 48, 72, 96 hours) and you will have all the unlimited transport for that period except the trains. excellent location, the center can be reached in 15 minutes by metro. latest gem ... the tea room, there is a kettle and all the rest! for me it was a great choice!",6.0,8.0,8.0,8.0,6.0,10.0,Riccardo G,"Piacenza d'Adige, Veneto, Italy",TripAdvisor,2012-08-25"GOOD HOTEL, NEAR THE CENTER.","HOTEL MODERMO, FACILITIES COMFORTABLE, ELEGANT, FREE INTERNET SERVICE, NEAR A METRO STATION 5 MINUTES, THE CLEANING SERVICE TIMES DID NOT CHANGE OF TOWELS. HIDDEN HOTEL ANNOUNCEMENT IS NOT EASY TO FIND WHEN YOU COME IN METRO. IN GENERAL THE WELL SPENT.VOLVERIA TO ARRIVE AT THE SAME HOTEL, I highly recommend it. ",6.0,8.0,,,,10.0,FERNANDO B,,Hotels.com,2011-09-01Aardig Hotel,"Upon entering, we are knowledgeable about the hotel. We found it nice and groomed. Public transport was doing was well within 10 minutes walk you to the subway. Though it was unfortunate when we came back in the evening the bar was closed and we could drink or eat anything. More It was possible to order a pizza and come pick up at reception. The bed of the hotel was very good. What we found was a shame that there are bird droppings on the middle window and sat there on the nightstand circles were a drink, and that the curtains were not completely clean because we saw namely whitish chalky stuff down. The breakfast was tasty but a bit simple. In short slept well just too much money for what it is.",4.0,6.0,8.0,8.0,6.0,10.0,Madieke H,"Breda, The Netherlands",TripAdvisor,2013-04-02Nice break,Just stayed here for 5 nights with friends and it was very good .Reception staff were very friendly. Rooms basic but were fine for us. If I had to gripe I would say they could have dusted a bit better. Anyway I would recommend this hotel. Also very near Amstel Station for convienience.,6.0,8.0,8.0,8.0,8.0,8.0,NorwichMags,Norwich,TripAdvisor,2013-07-28initial discomfort for the rest well,"I stayed at this hotel the first week of August for 6 nights. The impact was tragic, as we found the sheet of the bed internally full of hair, although clearly clean and ironed. To our reporting the hotel staff immediately proceeded to change our room. For the rest of the hotel is nice and modern, the center of Amsterdam is easily accessible by metro and bus. Particular not to be missed, the nearby Amstel station is well connected to the airport Schiphol. I did not partake of the breakfast, but I had dinner once and I can only speak well of the kitchen. Large portions and quality ingredients, with the option of eating outdoors. advised",4.0,8.0,6.0,8.0,6.0,8.0,saimonsays,"Padua, Italy",TripAdvisor,2013-08-17A great place to stay in Amsterdam,"We stayed at this hotel for a week in August 2012. The hotel is located 5 minutes walk away from Amstel railway station. We travelled to the hotel from Schiphol airport using the regional train to Amsterdam Centraal station, and then taking the Metro to the hotel. Although the Casa 400 isnÕt in the centre of Amsterdam it is only about 7 minutes away on the Metro and the trains run very often Ð about every 4 or 5 minutes. We found it to be very convenient and the Metro was very easy to use once we realised you have to check in and out through the gates marked ÔMetroÕ and not the ones marked ÔTrainÕ, otherwise you get trapped in at the other end and it wonÕt let you through the barriers!Check in at the hotel was very easy and quick for us. However, lots of times we passed the reception and there were lots of people waiting. The queue didnÕt seem very organised by the hotel either. Be aware that there is a 5% city tax (that all Amsterdam hotels charge) which wasnÕt included in our pre-booking and we had to pay upon arrival. Our room was very basic, but a good size, bright and appeared clean (although the carpet could have done with a good hoover as when we reached onto the floor to pick up a dropped remote control our hands were dirty and we found a hair grip).  The beds werenÕt particularly comfortable, but werenÕt bad enough to ruin our nightÕs sleep. The room contained a safe, large enough to hold a 17Ó laptop and also a fridge which meant that we could buy drinks and food and keep them cool. We took a travel kettle with us and the Amstel railway station close by has a small Albert Heijn store from which we were able to buy fresh milk. The television could receive BBC1,BBC2 and BBC3 and BBC World News, although these werenÕt always reliable and  the picture disappeared for a few days in the middle of our stay! The bathroom contained a shower (which was nothing special) and a large sink and toilet. One day during our stay the bin in our room wasnÕt emptied, but this was sorted immediately after a quick call to reception who sent a cleaner up. The WiFi is free and varied between being fast and slow depending on the time of the day. The hotel offer a service where you can prebuy tickets to certain Amsterdam museums at reception. Unfortunately this was unavailable when we were there as the receptionist was unable to access the system. However, because of the free wifi that is available in the hotel, we were able to book our own tickets online and email them to reception. They promptly printed these out for us, which meant that we were able to save over an hour queuing at the Van Gogh museum and the Anne Frank house!There is a room on each floor which has an iron available for people to use. There are no hairdryers provided, but you can borrow one from reception. There is some building work going on close to the hotel at the moment, but ear plugs are available for free at reception. In our experience though, the noise was nothing at all to worry about! There is an ice dispenser available for free on some of the floors of the hotel. There are 4 lifts in the hotel, but this didnÕt seem enough at busy times of day as often the lifts took a long time to arrive or were full when they did!As mentioned earlier, the hotel is situated close to Amstel station, which means you can take the Metro straight into the centre. In addition, the Number 12 tram also stops at the station Ð this means you can be at the Museum Quarter in 15 minutes. The location was perfect for us, as it was away from the hustle and bustle of the centre, but close enough to be able to get swiftly to the places we wanted to on the Metro and Tram. There is an expensive restaurant on the ground floor and a bar on the first floor which serves simple snacks and meals. We didnÕt try out either option, but they seemed busy each time we passed. Overall, we were impressed by the Casa 400 and would definitely consider staying here again.",6.0,8.0,8.0,6.0,8.0,8.0,GyroscopeUK,"Birmingham, United Kingdom",TripAdvisor,2012-09-01I didn't like and will not back,"Dereje ShitawI stayed on this Hotel for 3 nights. The hotel looks modern superficially. But the service and breakfast in particular are in big question mark. My bed sheets were not changed, the room was not cleaned very well. There are very few alternative to eat breakfast.  I don't recomend someone to book a room for more than one night. Dj",2.0,4.0,6.0,,,4.0,Merkato,"Oslo, Norway",TripAdvisor,2011-07-27so-so,"the hotel is quite a way out from the center and you can walk to the metro stationthe reception staff are friendly but the breakfast room is very bad!the quality of the breakfast is not very good and the service is pretty bad.the room is average, but above all they are doing right in front of the work and the rooms are not soundproof!not really recommend the hotel for a visit to amsterdam ",6.0,4.0,4.0,,,6.0,cuddlesome_c,treviso,TripAdvisor,2011-08-22Very good value for money,"We chose Casa 400, because it was by far the cheapest -. Although not as centrally located for the price of a few taxi rides we saved loose in the room.Breakfast in the hotel is expensive - we just always somewhere else feasted about half the price.Rooms were not cleaned well - even large spots on Nachtkasterl and something sticky on the door and vanity had been overlooked. In our complaint was the room and immediately took that right.Practical: the entire window front is a tabletop (including cable plant for internet etc), so you really have a lot of storage space. Incidentally, boxes, etc., very large - so often what is really a problem in Amsterdam.We had connecting rooms. There were double doors. This is well thought of in order to reduce noise, but as an actual connection unusable contrast to opening doors, both extremely stiff (you had to really lean against) and with automatic closers, who had quickly and very loud fall back into the lock the doors. No way to keep the doors open.Total: very good and recommendable ",6.0,8.0,10.0,10.0,8.0,8.0,rokras,Wien,TripAdvisor,2011-11-03